{
  "episode_id": "EP001",
  "concept_name": "公地悲剧",
  "plain_definition": "当多人可以自由使用一种有限的共享资源，而个人又能获得多使用一份的直接收益、却只承担资源损耗的一小部分时，所有人的合理选择可能共同耗尽这项资源。",
  "necessary_conditions": [
    "资源有限且可被多人共同使用",
    "个人使用收益主要归自己",
    "资源损耗成本由群体共同承担",
    "缺少有效的产权、配额、协商或执行机制"
  ],
  "causal_chain": [
    {
      "step": 1,
      "cause": "共享资源对所有人开放，额外使用的即时成本很低",
      "effect": "每个参与者都有多取一点的动机"
    },
    {
      "step": 2,
      "cause": "个人获得完整收益，却只承担总损耗的一小部分",
      "effect": "克制者反而可能感觉吃亏"
    },
    {
      "step": 3,
      "cause": "越来越多人复制同一选择",
      "effect": "使用速度超过资源恢复或承载能力"
    },
    {
      "step": 4,
      "cause": "资源质量下降或存量耗尽",
      "effect": "包括早期获益者在内的所有人承受长期损失"
    }
  ],
  "perspectives": {
    "individual": "在别人也可能多拿的情况下，自己多拿一点具有短期合理性。",
    "system": "大量相似选择叠加后，资源消耗不再是局部事件，而成为反馈循环。",
    "long_term": "如果没有规则、协商或边界，短期收益可能被更大的共同损失抵消。"
  },
  "real_world_examples": [
    {
      "name": "公司共享茶水间",
      "explanation": "每个人多拿几包零食几乎没有直接惩罚，但所有人都这样做会让公共补给迅速耗尽。",
      "daily_life": true
    },
    {
      "name": "近海过度捕捞",
      "explanation": "单个渔民多捕一些能增加收入，但总体捕捞超过鱼群恢复速度时，整个渔业都会衰退。",
      "daily_life": false
    }
  ],
  "counterexamples": [
    "资源实际上近乎无限，或使用不会降低他人的可用量时，不构成典型公地悲剧。",
    "群体已经形成可执行的配额、轮值或产权安排时，开放使用不一定导致耗尽。"
  ],
  "common_misunderstandings": [
    "把它理解成只要有人自私就会发生，而忽略制度和成本分配。",
    "认为唯一解决方法是私有化；现实中配额、社区治理和公共监管也可能有效。"
  ],
  "metaphor_ingredients": {
    "objects": [
      "可恢复但恢复较慢的公共水井",
      "每户自有木桶"
    ],
    "rules": [
      "人人可自由取水",
      "没有单户上限",
      "井水每天只恢复固定水位"
    ],
    "incentives": [
      "多存水能降低个人对未来缺水的风险",
      "少拿的人担心别人先拿完"
    ],
    "conflicts": [
      "个人安全感与公共水位之间的冲突",
      "克制者与囤水者之间的相互猜疑"
    ],
    "outcomes": [
      "取水行为自我强化",
      "井水恢复不及消耗",
      "所有人最终缺水"
    ]
  },
  "simplification_policy": {
    "may_omit": [
      "完整的公共资源治理理论",
      "不同产权制度的详细比较"
    ],
    "must_keep": [
      "个人选择在当下具有合理性",
      "成本被分散给所有人",
      "资源存在恢复上限",
      "结果来自选择叠加而非单一坏人"
    ]
  },
  "accuracy_risk": {
    "level": "low",
    "review_notes": [
      "旁白中必须说明井水恢复有限，不能设定成真正永不枯竭。",
      "结尾避免暗示所有公共资源都必然失败。"
    ]
  }
}
